{
  "name": "algolia",
  "description": "Simulates the Algolia Search API including search, indexing, index management, settings, synonyms, rules, and API key management.",
  "category": "search",
  "sdk": {
    "package": "github.com/algolia/algoliasearch-client-go",
    "version": "v3"
  },
  "default_port": 4123
}
