{
  "name": "loyaltylion",
  "description": "Simulates the LoyaltyLion REST API v2 for customer management, points operations, reward redemption, and activity recording with multi-merchant isolation.",
  "category": "loyalty",
  "sdk": {
    "package": "LoyaltyLion REST API",
    "version": "v2"
  },
  "default_port": 8090
}
