{
  "name": "qbo",
  "description": "Simulates the QuickBooks Online Accounting API v3 — chart of accounts, customers, vendors, invoices, bills, payments, journal entries, and financial reports with SQL-like query language.",
  "category": "accounting",
  "sdk": {
    "package": "github.com/rwestlund/quickbooks-go",
    "version": "v0.5"
  },
  "default_port": 4116
}
