{
  "name": "linear",
  "description": "Simulates the Linear GraphQL API including issues, teams, projects, cycles, workflow states, labels, comments, attachments, relations, documents, and webhooks.",
  "category": "workspace",
  "sdk": {
    "package": "@linear/sdk",
    "version": "latest"
  },
  "default_port": 4121
}
