{
  "name": "github",
  "description": "Emulates the GitHub REST API at calendar version 2026-03-10: repositories, contents and git data, issues, pull requests and reviews, commit statuses and check runs, GitHub App installation tokens, releases, workflow dispatch, and signed webhook delivery.",
  "category": "vcs",
  "sdk": {
    "package": "@octokit/plugin-rest-endpoint-methods",
    "version": "17.0.0"
  },
  "default_port": 4119
}
